{
  "$schema": "./compatibility.schema.json",
  "schemaVersion": 1,
  "baseline": {
    "tag": "dsh-v0.1.1-rc.2",
    "version": "0.1.1-rc.2",
    "commit": "b150a551b8d465e31e418e1b2eaf5e79bbb7d28e",
    "betterSidebar": "0.17.1",
    "schemastery": "3.18.1",
    "react": "18.3.1"
  },
  "contract": {
    "base": "ONCLAW-BASE-1",
    "hostHif": "ONCLAW-HOST-HIF-1",
    "clientHifs": ["ONCLAW-HIF-1", "ONCLAW-HIF-2"]
  },
  "providerInjection": [
    "@deepseek-ai/dsh-client-ui-sidebar",
    "@deepseek-ai/dsh-client-ui-conversation",
    "@deepseek-ai/dsh-client-ui-settings",
    "dsh-better-sidebar"
  ],
  "tags": [
    {
      "tag": "dsh-v0.1.0-rc.7",
      "version": "0.1.0-rc.7",
      "commit": "99f6f02fecdb7dff40c3fbc9470f5907c29f74ca",
      "contract": "ONCLAW-BASE-1",
      "hostHif": "ONCLAW-HOST-HIF-1",
      "clientHif": "ONCLAW-HIF-1",
      "schemastery": "3.18.1",
      "providers": {
        "@deepseek-ai/dsh-client-runtime": "0.1.0-rc.7",
        "@deepseek-ai/dsh-client-ui-conversation": "0.1.0-rc.7",
        "@deepseek-ai/dsh-client-ui-settings": "0.1.0-rc.7",
        "@deepseek-ai/dsh-client-ui-sidebar": "0.1.0-rc.7",
        "@deepseek-ai/dsh-client-ui-slots": "0.1.0-rc.7"
      },
      "missingPackages": [],
      "betterSidebar": { "version": "0.13.1", "relationship": "formal", "reason": "Harness dependency and consumed service methods match." },
      "audited": { "status": "passed", "reason": "Immutable local tag source audited on 2026-09-06." },
      "registry": { "status": "passed", "reason": "Exact legacy client providers are published." },
      "packageVerification": { "status": "passed", "reason": "The same unmodified candidate tarball installed with exact target dependencies on 2026-09-06; digest retained in release-evidence." },
      "liveSmoke": { "status": "not-run", "reason": "Onclaw live Harness smoke has not yet run." }
    },
    {
      "tag": "dsh-v0.1.0-rc.8",
      "version": "0.1.0-rc.8",
      "commit": "141eb6fef83422698aef7a981029e843e8161534",
      "contract": "ONCLAW-BASE-1",
      "hostHif": "ONCLAW-HOST-HIF-1",
      "clientHif": "ONCLAW-HIF-1",
      "schemastery": "3.18.1",
      "providers": {
        "@deepseek-ai/dsh-client-runtime": "0.1.0-rc.8",
        "@deepseek-ai/dsh-client-ui-conversation": "0.1.0-rc.8",
        "@deepseek-ai/dsh-client-ui-settings": "0.1.0-rc.8",
        "@deepseek-ai/dsh-client-ui-sidebar": "0.1.0-rc.8",
        "@deepseek-ai/dsh-client-ui-slots": "0.1.0-rc.8"
      },
      "missingPackages": [],
      "betterSidebar": { "version": "0.17.1", "relationship": "formal", "reason": "Harness dependency and consumed service methods match." },
      "audited": { "status": "passed", "reason": "Immutable local tag source audited on 2026-09-06." },
      "registry": { "status": "passed", "reason": "Exact legacy client providers are published." },
      "packageVerification": { "status": "passed", "reason": "The same unmodified candidate tarball installed with exact target dependencies on 2026-09-06; digest retained in release-evidence." },
      "liveSmoke": { "status": "not-run", "reason": "Onclaw live Harness smoke has not yet run." }
    },
    {
      "tag": "dsh-v0.1.1-rc.1",
      "version": "0.1.1-rc.1",
      "commit": "528c682e061696f5a160f363f236ecbf53cbd006",
      "contract": "ONCLAW-BASE-1",
      "hostHif": "ONCLAW-HOST-HIF-1",
      "clientHif": "ONCLAW-HIF-1",
      "schemastery": "3.18.1",
      "providers": {
        "@deepseek-ai/dsh-client-runtime": "0.1.1-rc.1",
        "@deepseek-ai/dsh-client-ui-conversation": "0.1.1-rc.1",
        "@deepseek-ai/dsh-client-ui-settings": "0.1.1-rc.1",
        "@deepseek-ai/dsh-client-ui-sidebar": "0.1.1-rc.1",
        "@deepseek-ai/dsh-client-ui-slots": "0.1.1-rc.1"
      },
      "missingPackages": [],
      "betterSidebar": { "version": "0.17.1", "relationship": "candidate", "reason": "Consumed API is stable; published prerelease peer does not formally include rc.1." },
      "audited": { "status": "passed", "reason": "Immutable local tag source audited on 2026-09-06." },
      "registry": { "status": "passed", "reason": "Exact legacy client providers are published." },
      "packageVerification": { "status": "passed", "reason": "The same unmodified candidate tarball installed with exact target dependencies on 2026-09-06; digest retained in release-evidence." },
      "liveSmoke": { "status": "not-run", "reason": "Onclaw live Harness smoke has not yet run." }
    },
    {
      "tag": "dsh-v0.1.1-rc.2",
      "version": "0.1.1-rc.2",
      "commit": "b150a551b8d465e31e418e1b2eaf5e79bbb7d28e",
      "contract": "ONCLAW-BASE-1",
      "hostHif": "ONCLAW-HOST-HIF-1",
      "clientHif": "ONCLAW-HIF-1",
      "schemastery": "3.18.1",
      "providers": {
        "@deepseek-ai/dsh-client-runtime": "0.1.1-rc.2",
        "@deepseek-ai/dsh-client-ui-conversation": "0.1.1-rc.2",
        "@deepseek-ai/dsh-client-ui-settings": "0.1.1-rc.2",
        "@deepseek-ai/dsh-client-ui-sidebar": "0.1.1-rc.2",
        "@deepseek-ai/dsh-client-ui-slots": "0.1.1-rc.2"
      },
      "missingPackages": [],
      "betterSidebar": { "version": "0.17.1", "relationship": "candidate", "reason": "Current proven development baseline; published prerelease peer does not formally include rc.2." },
      "audited": { "status": "passed", "reason": "Immutable baseline source audited on 2026-09-06." },
      "registry": { "status": "passed", "reason": "Exact baseline client providers are published." },
      "packageVerification": { "status": "passed", "reason": "The same unmodified candidate tarball installed with exact target dependencies on 2026-09-06; digest retained in release-evidence." },
      "liveSmoke": { "status": "not-run", "reason": "A fresh live smoke for this candidate has not yet run." }
    },
    {
      "tag": "dsh-v0.1.2-alpha.1",
      "version": "0.1.2-alpha.1",
      "commit": "cd5ef8148158c3a752a658978873241fdf8e2bbc",
      "contract": "ONCLAW-BASE-1",
      "hostHif": "ONCLAW-HOST-HIF-1",
      "clientHif": "ONCLAW-HIF-2",
      "schemastery": "3.18.1",
      "providers": {},
      "missingPackages": ["@deepseek-ai/dsh-api-session-controller@0.1.2-alpha.1", "@deepseek-ai/dsh-client-ui-renderer@0.1.2-alpha.1", "@deepseek-ai/dsh-client-ui-workspace@0.1.2-alpha.1", "@deepseek-ai/dsh-client-ui-sidebar@0.1.2-alpha.1", "@deepseek-ai/dsh-client-ui-conversation@0.1.2-alpha.1"],
      "betterSidebar": { "version": null, "relationship": "no-match", "reason": "No matching Better Sidebar release is available." },
      "audited": { "status": "passed", "reason": "Immutable tag object audited on 2026-09-06; local runtime checkout is intentionally excluded for the Node ESM loader defect." },
      "registry": { "status": "blocked", "reason": "Exact split-client provider packages were not published." },
      "packageVerification": { "status": "blocked", "reason": "Exact providers and a reproducible local runtime are unavailable." },
      "liveSmoke": { "status": "blocked", "reason": "Node 24.0-24.11.1 ESM loader detection yields an empty client module graph." }
    },
    {
      "tag": "dsh-v0.1.2-alpha.2",
      "version": "0.1.2-alpha.2",
      "commit": "0a53fb55bea101816fa226bb964ae2bed71c343b",
      "contract": "ONCLAW-BASE-1",
      "hostHif": "ONCLAW-HOST-HIF-1",
      "clientHif": "ONCLAW-HIF-2",
      "schemastery": "3.18.2",
      "providers": { "@deepseek-ai/dsh-api-session-controller": "0.1.2-alpha.2", "@deepseek-ai/dsh-client-ui-renderer": "0.1.2-alpha.2", "@deepseek-ai/dsh-client-ui-workspace": "0.1.2-alpha.2", "@deepseek-ai/dsh-client-ui-sidebar": "0.1.2-alpha.2", "@deepseek-ai/dsh-client-ui-conversation": "0.1.2-alpha.2" },
      "missingPackages": [],
      "betterSidebar": { "version": "0.18.0-alpha.0", "relationship": "formal", "reason": "Published peer and consumed service methods match." },
      "audited": { "status": "passed", "reason": "Immutable local tag source audited on 2026-09-06." },
      "registry": { "status": "passed", "reason": "Exact split-client providers are published." },
      "packageVerification": { "status": "passed", "reason": "The same unmodified candidate tarball installed with exact target dependencies on 2026-09-06; digest retained in release-evidence." },
      "liveSmoke": { "status": "not-run", "reason": "Onclaw live Harness smoke has not yet run." }
    },
    {
      "tag": "dsh-v0.1.2-alpha.3",
      "version": "0.1.2-alpha.3",
      "commit": "dd6322d604e00eec1ba5e0c8541159906a21094a",
      "contract": "ONCLAW-BASE-1",
      "hostHif": "ONCLAW-HOST-HIF-1",
      "clientHif": "ONCLAW-HIF-2",
      "schemastery": "3.18.2",
      "providers": { "@deepseek-ai/dsh-api-session-controller": "0.1.2-alpha.3", "@deepseek-ai/dsh-client-ui-renderer": "0.1.2-alpha.3", "@deepseek-ai/dsh-client-ui-workspace": "0.1.2-alpha.3", "@deepseek-ai/dsh-client-ui-sidebar": "0.1.2-alpha.3", "@deepseek-ai/dsh-client-ui-conversation": "0.1.2-alpha.3" },
      "missingPackages": [],
      "betterSidebar": { "version": "0.18.0-alpha.0", "relationship": "formal", "reason": "Published peer and consumed service methods match." },
      "audited": { "status": "passed", "reason": "Immutable local tag source audited on 2026-09-06." },
      "registry": { "status": "passed", "reason": "Exact split-client providers are published." },
      "packageVerification": { "status": "passed", "reason": "The same unmodified candidate tarball installed with exact target dependencies on 2026-09-06; digest retained in release-evidence." },
      "liveSmoke": { "status": "not-run", "reason": "Onclaw live Harness smoke has not yet run." }
    },
    {
      "tag": "dsh-v0.1.2-alpha.4",
      "version": "0.1.2-alpha.4",
      "commit": "4e84901e6471b79ec0338099867ebb4606d12bb5",
      "contract": "ONCLAW-BASE-1",
      "hostHif": "ONCLAW-HOST-HIF-1",
      "clientHif": "ONCLAW-HIF-2",
      "schemastery": "3.18.2",